{
  "schema_version":"1.0.0-draft",
  "programme_id":"SU-REGULATION-OPENFDA-UDI-v0.1",
  "status":"NONCANONICAL_PROGRAMME_CONTROL",
  "source_universe_id":"SU-REGULATION",
  "source_system":"OPENFDA_DEVICE_UDI_GUDID",
  "as_of":"2026-09-01",
  "provider_contract":{"provider":"U.S. FDA openFDA Unique Device Identifier API (GUDID)","endpoint":"https://api.fda.gov/device/udi.json","method":"GET","response_media_type":"application/json","source_dataset":"Global Unique Device Identification Database (GUDID)","time_period_start":"2013","provider_update_frequency":"WEEKLY","reported_denominator_path":"meta.results.total","skip_path":"meta.results.skip","limit_path":"meta.results.limit","results_path":"results","max_records_per_request":1000,"max_skip":25000,"max_direct_result_count":26000,"provider_supports_bulk_downloads":true,"bulk_download_requires_all_files_for_complete_current_dataset":true,"old_records_may_change_on_provider_update":true,"configuration_performs_http":false},
  "workbench_dependency":{"minimum_package_line":"0.3.0.dev0","required_capability":"project_openfda_udi_pages","integration_state":"AVAILABLE"},
  "identity_policy":{"device_record_identity":"PRIMARY_DI_ISSUING_AGENCY_PLUS_ID","exactly_one_primary_di_required_for_candidate":true,"primary_di_is_gudid_record_primary_key":true,"record_key_is_provider_tracking_key_not_device_identity":true,"public_version_fields_track_record_updates":true,"same_primary_di_changed_public_version_is_successor_observation":true,"secondary_di_auto_merge":false,"previous_di_auto_merge":false,"direct_marking_di_auto_merge":false,"unit_of_use_di_auto_merge":false,"package_di_auto_merge":false,"premarket_submission_auto_authorization_relationship":false,"product_code_auto_system_merge":false,"brand_name_auto_system_merge":false,"company_name_auto_entity_merge":false,"conflicting_same_primary_di_identity_policy":"FAIL_CLOSED"},
  "inclusion_policy":{"candidate_scope":"DECLARED_OPENFDA_UDI_SEARCH_MATCH_WITH_EXACT_PRIMARY_DI","automatic_source_admission":false,"automatic_device_or_system_entity_creation":false,"automatic_company_entity_creation":false,"automatic_di_relationship_creation":false,"automatic_premarket_authorization_relationship_creation":false,"automatic_current_commercial_availability_claim_creation":false,"automatic_marketing_authorization_claim_creation":false,"automatic_effectiveness_claim_creation":false,"automatic_system_conformance_claim_creation":false,"automatic_assessment_mutation":false,"automatic_reopening_decision":false,"automatic_monitor_creation":false,"human_relevance_review_required":true},
  "paging_policy":{"execution_mode_v0_1":"SKIP_LIMIT_BOUNDED","page_limit":1000,"initial_skip":0,"max_skip":25000,"max_direct_result_count":26000,"over_limit_policy":"BULK_DOWNLOAD_OR_PUBLIC_VERSION_DATE_PARTITION_REQUIRED_BEFORE_MATERIALIZATION","preferred_partition_field":"public_version_date","silent_truncation_allowed":false,"partial_over_limit_candidate_emission_allowed":false,"bulk_download_not_yet_authorized_by_v0_1_projector":true,"partition_provenance_required":true},
  "query_streams":[
    {"query_id":"DISCOVERY-OPENFDA-UDI-BCI-001","search":"device_description:\"brain+computer+interface\"+OR+device_description:\"brain+machine+interface\"+OR+device_description:\"neural+interface\"","cadence":"WEEKLY","status":"ACTIVE","scope_tiers":["A"],"purpose":"GUDID device-record discovery for explicit BCI/neural-interface terminology.","completeness_claim":false},
    {"query_id":"DISCOVERY-OPENFDA-UDI-DBS-NEUROSTIM-001","search":"device_description:\"deep+brain+stimulator\"+OR+device_description:\"deep+brain+stimulation\"+OR+device_description:neurostimulator","cadence":"WEEKLY","status":"ACTIVE","scope_tiers":["A","B"],"purpose":"GUDID device-record discovery for DBS and neurostimulator terminology.","completeness_claim":false},
    {"query_id":"DISCOVERY-OPENFDA-UDI-NEUROPROSTHESIS-001","search":"device_description:neuroprosthesis+OR+device_description:\"neural+prosthesis\"+OR+device_description:\"brain+prosthesis\"","cadence":"WEEKLY","status":"ACTIVE","scope_tiers":["A","B"],"purpose":"GUDID device-record discovery for neuroprosthetic terminology.","completeness_claim":false},
    {"query_id":"DISCOVERY-OPENFDA-UDI-VISUAL-NEUROPROSTHESIS-001","search":"device_description:\"retinal+prosthesis\"+OR+device_description:\"retinal+implant\"+OR+device_description:\"visual+prosthesis\"","cadence":"WEEKLY","status":"ACTIVE","scope_tiers":["A","B"],"purpose":"GUDID device-record discovery for retinal and visual neuroprosthetic terminology.","completeness_claim":false},
    {"query_id":"DISCOVERY-OPENFDA-UDI-NEURAL-RECORDING-001","search":"device_description:\"intracortical+electrode\"+OR+device_description:\"brain+electrode\"+OR+device_description:electrocorticography","cadence":"WEEKLY","status":"ACTIVE","scope_tiers":["A","B"],"purpose":"GUDID device-record discovery for invasive neural-recording terminology.","completeness_claim":false}
  ],
  "candidate_projection":{"required_fields":["record_identity","primary_di","primary_di_issuing_agency","record_key","record_status","public_version_number","public_version_date","public_version_status","publish_date","brand_name","company_name","version_or_model_number","catalog_number","device_description","commercial_distribution_status","commercial_distribution_end_date","identifiers","premarket_submissions","product_codes","query_memberships","normalized_record_sha256"],"customer_contact_fields_in_discovery_layer":false,"labeler_duns_number_in_discovery_layer":false,"raw_api_pages_emitted_to_s2":false,"secondary_or_previous_di_relationships_created_in_projection":false,"premarket_submission_relationships_created_in_projection":false},
  "coverage_contract":{"required_metrics_per_leaf_query":["supplied_page_count","returned_record_count","unique_primary_di_record_count","reported_total_count","reported_total_count_state","skip_sequence_valid","skip_coverage_state","over_26000_limit","bulk_download_or_partition_required","known_controlled_duplicate_count","new_candidate_count","duplicate_representation_count","unresolved_primary_di_count","multiple_primary_di_count"],"mechanical_completion_requires":{"reported_total_count_state":"CONSISTENT","skip_sequence_valid":true,"skip_coverage_state":"MATCH","over_26000_limit":false,"bulk_download_or_partition_required":false,"unresolved_primary_di_count":0,"multiple_primary_di_count":0},"gudid_database_completeness_claim":false,"global_neuroai_udi_coverage_claim":false,"query_recall_claim":false,"gudid_presence_is_marketing_authorization_claim":false,"commercial_distribution_status_is_independent_market_availability_proof":false,"premarket_submission_link_is_exact_configuration_authorization_claim":false,"primary_di_is_clinical_effectiveness_claim":false,"primary_di_is_system_conformance_claim":false},
  "human_review_contract":{"required_dispositions":["ACCEPT","REJECT","DEFER","EXCLUDE"],"review_questions":["Is this exact Primary DI materially relevant to a represented NeuroAI/neurotechnology device or configuration?","Is there exactly one Primary DI and is its issuing agency preserved?","Do Secondary, Previous, Direct Marking, Unit of Use or Package identifiers support explicit relationships without automatic merging?","What does the public record version indicate about changes to this DI record over time?","Do premarket-submission references support a relationship to a 510(k), PMA, HDE or other record without assuming exact configuration equivalence?","What does the submitted commercial-distribution status support, and what present-market inference remains prohibited?","Could this device-record change create a candidate assessment reopening trigger, and what human authority must decide it?"],"automatic_acceptance":false,"gudid_record_is_marketing_authorization_evidence":false,"commercial_distribution_status_is_independent_current_availability_evidence":false,"premarket_submission_link_establishes_exact_assessed_configuration":false,"primary_di_is_effectiveness_evidence":false,"primary_di_is_all_configuration_conformance_evidence":false,"udi_record_automatically_reopens_assessment":false},
  "network_policy":{"live_execution":"OPT_IN_ONLY","requires_workbench_network_gate":true,"configuration_performs_http":false,"hosted_success_claim_allowed_without_runner_steps":false},
  "boundary":"This programme discovers GUDID/openFDA UDI device-identification records. The exact Primary DI plus issuing agency is the device-record identity anchor; FDA-assigned record/public-version fields track updates to that public record. GUDID presence and submitted commercial-distribution state do not by themselves establish marketing authorization, current real-world availability, clinical effectiveness, exact assessed-system configuration, system conformance, automatic assessment reopening, or UNESCO/institutional endorsement. Premarket-submission and secondary/previous identifier fields remain linkage evidence requiring explicit human resolution."
}